<!ELEMENT chatbot ((option)*, (network)*)>

<!ELEMENT network ((channel)*, (option)*)>
<!ATTLIST network
	name CDATA #REQUIRED
>

<!ELEMENT channel (option)*>
<!ATTLIST channel
	name CDATA #REQUIRED
>

<!ELEMENT option EMPTY>
<!ATTLIST option
	name CDATA #REQUIRED
	value CDATA #REQUIRED
>
